27/03/2015,F011-00000032,1,PEN,71.5,,,12.87,12.87,PEN,,,,,,,,,,84.37
EMPRESAS COMERCIALES S.A. Y/O EMCOMER S.A.,EMCOMER S.A.,20101951872,150122,AV.RICARDO PALMA 341, INT.1101,,LIMA,LIMA,MIRAFLORES,PE,ORIGEN03,SISTEMAS015
10444971202,6,AGUILAR BLANCO, MAXIMILIANO,,150133,SECTOR EL NAZARENO MZ L2 LOTE 7 PUEBLO PAMPLONA ALTA,,LIMA,LIMA,SAN JUAN DE MIRAFLORES,PE
Son: OCHENTA Y CUATRO y 37/100 NUEVOS SOLES,,
,,- No sujeto a retencion de Igv por ser agente de retencion segun Resolucion de Superintendencia #037-2002/SUNAT.,- Representacion impresa de la factura electronica, consultela en www.bata.aqcatalogo.com.pe/consulta,- Autorizado a ser emisor electronico segun Resolucion de Intendencia #01800500001113/SUNAT.,- Al vencimiento de su obligacion se aplicaran intereses y moras de acuerdo a ley +3% de comision por cobranza.
1,PAR,1,FLATTIES CELINA, CUERO NEGRO C/FLEC,36,1,6.48,6.48,10,1000,,,,,556-6840.1,36,36,,,18,,,36
2,PAR,1,Clavel, cuero, beige, suela Caucho,,35.5,1,6.39,6.39,10,1000,,,,,556-8838.1,35.5,35.5,,,18,,,35.5
FF00FF
